krankenkasse,problem,empfehlung,begruendung
Mobil Krankenkasse,Service Index unter Markt,Serviceprozesse optimieren und Schulungen im Kundenservice,Kundenservice beeinflusst CX Score stark
Mobil Krankenkasse,Digital Index unter Markt,Self Service Funktionen und App Features ausbauen,Digitale Services reduzieren Kontaktaufkommen
hkk Krankenkasse,Digital Index ausbauen,Mehr digitale Services und Online Antragssysteme,Digitalisierung steigert Effizienz
AOK PLUS,Preis Index niedrig,Marketing auf Service und Prävention fokussieren,Höherer Beitrag muss durch Leistungen kompensiert werden
IKK Südwest,Service Index verbessern,Bearbeitungszeiten und Erstlösungsquote erhöhen,Service ist zentraler Treiber für Kundenzufriedenheit
